{"artifact_kind":"FULL_CANDIDATE_BRF","artifact_sha256":"9b13336e1833b9491207f26720eae9a8c9132b75a232acdac1a9f76834baa736","baseline_manifest_sha256":null,"byte_length":1048,"created_at":"2026-01-01T00:00:00Z","formatter_version":"relay-formatter.v1","generator_build":{"profile_sha256":"7011f99e9351d9d70da9eddf89a2d38c3c88318e325cb4422ec98f492a9d2772","source_map_sha256":"3b5a6c0f4ab0613ad801d3c056c497e422386103c801bc925c93e599bda99a39"},"liblouis_version":"3.38.0","normalized_source_sha256":"7d3875f59373e68209cda475d4792b50fab4731ab70b824ce609e7cc63cad0c7","page_count":1,"page_range":null,"page_sha256":["9b13336e1833b9491207f26720eae9a8c9132b75a232acdac1a9f76834baa736"],"parent_artifact_sha256":null,"schema_version":"artifact-manifest.v1","source_map_uri":"maps/9b13336e1833b9491207f26720eae9a8c9132b75a232acdac1a9f76834baa736.json","source_revision_id":"drive:fixture:v1","source_sha256":"7d3875f59373e68209cda475d4792b50fab4731ab70b824ce609e7cc63cad0c7","translation_profile_sha256":"7011f99e9351d9d70da9eddf89a2d38c3c88318e325cb4422ec98f492a9d2772"}
