{"artifact_kind":"FULL_CANDIDATE_BRF","artifact_sha256":"50ace14f16d7bdeba6a8b6e267a3ab2c9659e157ffe72ff4f25b886f6404aa7d","baseline_manifest_sha256":null,"byte_length":1048,"created_at":"2026-01-01T00:00:00Z","formatter_version":"relay-formatter.v1","generator_build":{"profile_sha256":"7011f99e9351d9d70da9eddf89a2d38c3c88318e325cb4422ec98f492a9d2772","source_map_sha256":"3b5a6c0f4ab0613ad801d3c056c497e422386103c801bc925c93e599bda99a39"},"liblouis_version":"3.38.0","normalized_source_sha256":"a0e6c932eea2c5bd530f2c51597421a6a5e4af855e06a969e8eef683eee72b28","page_count":1,"page_range":null,"page_sha256":["50ace14f16d7bdeba6a8b6e267a3ab2c9659e157ffe72ff4f25b886f6404aa7d"],"parent_artifact_sha256":null,"schema_version":"artifact-manifest.v1","source_map_uri":"maps/50ace14f16d7bdeba6a8b6e267a3ab2c9659e157ffe72ff4f25b886f6404aa7d.json","source_revision_id":"drive:fixture:v2","source_sha256":"a0e6c932eea2c5bd530f2c51597421a6a5e4af855e06a969e8eef683eee72b28","translation_profile_sha256":"7011f99e9351d9d70da9eddf89a2d38c3c88318e325cb4422ec98f492a9d2772"}
