{"artifact_kind":"FULL_CANDIDATE_BRF","artifact_sha256":"7148cb69965b72f0ed85ff250d2057287f84ae091f1c9327c9c34d47aaa536b8","baseline_manifest_sha256":null,"byte_length":48253,"created_at":"2026-01-01T00:00:00Z","formatter_version":"relay-formatter.v1","generator_build":{"profile_sha256":"7011f99e9351d9d70da9eddf89a2d38c3c88318e325cb4422ec98f492a9d2772","source_map_sha256":"97149d3bb03597122b9b34937d1824c4c1d0238217ec04219ea7dce41683a700"},"liblouis_version":"3.38.0","normalized_source_sha256":"b8560cf15b8323d0758eff1829ec29dfec6512aa797531f07d0891d29aa89222","page_count":46,"page_range":null,"page_sha256":["c1aa1e809257f4e4f2df530ab5e8322f5ccd4bb6715bb4fb9a7c06eba5bc6b62","72d7215b36d4126028e782e0df2faf0b8ff8178e88c7771839e247808a2ca0d3","a5fdb721a7a7de8ab49aafeacb99101af9846448a80df639740af79e17beedec","f32b78bdcb07b3af9d34a35086d08fecb57ca26c4385d460f5bdf5356d3b0ad7","9cfc1100ff0b864e9ea6cd6ae753f91299017f7018e1fa9e65d935054bff8bec","563215fd349f221b86c906f5e508af30da93a343e9ec125a655b7c06cf9402f5","c1b4f53f3b74e3f94d4c6f2bac1c00d6e5a2f77c905657d876fe5344022e9342","dab00eb575c869e84121824df3e136f9ff2697b3e7a4403e19381ad62b1d16ab","065a6ef74b0a26305b58d17cb4b8b15016dc9f52219e45480a24b34f4d844c9a","807a7802de352c558dd0ec3fb96011195ba793765d5a4061dd524e5bd0779951","6687c7e6458ca5b50a90a379f60839769c584e7574ba4fdf94913c34b827e192","4dfc2eaefa41c8e862f82e13dc03b6ebc9b9e18d468aa9df83969c359906ca0e","70ba43df40e1ed465015fde486685e3e3db2ca6f49670d57b05b216f6cdf9111","365ece5e08ccab7ad660a6dde973f13f3bce90c94748b1aacf77e295c6867ae5","e5724f760542482b92a04af9cd885284b83a38d8f378ae4e9fa97b94117291ed","9475c230e0c7644eb646e989df291a8538afd6fe3cabb5ede0b51a382b136e23","dbd034a654ae8de0773da354e1922a09a026792c9cdb5a5f680ab63248b8ed64","16c4c9626724c5b1fb5c2fdb9dd325fc2a74c44356146e5dd3711135deaa99de","d884f5ecba1e85e5fa2db9d53e412fe867556f4d88e1b4488712cdc6e7206366","259fd256a71fe708ed2746fa8b56693cb80d0a2f297b7923fec0237319d388ef","341f61628984f5355c5cf4a750a444782baceb865c692fc0e93f1414909aea72","b12a368d908f1b297319201ac0012bd100fcc5372508231cd26cbff792d7092b","644ea661db16d03a3997d968d20cf118e10759609c65dacfff28d7beea874f81","559d3e61d66bcc2e1bc3e090396b86c79b4b5805ee122cc7db4de868d4bb7c04","b545d3132571746531df92ebc8799607060f24abc29876a8aaa2441023087d22","f803299ba1ff6a93e808e8e5ab2c49295f87191623590748099c58701472a840","7ef6509989db4b82a594352d2b4c43d562bd72a3cc2489dd7496224d5d437f32","6211a6475525c95b4b78e8feb68bdfb05fdfbeeaea8e889498ce7b505c81ac06","f3f1dfabf86935cc208dc07f87785179f6f92fa710768e54c64860431f4936e6","3f545bef56b9bde006cfba7ba0ee31dd150baece09ac0de950e4b0b3266a6e56","497f9333edf4f53c5c7f1bb8d7004d4418d430f206e2e363e08b02ab30a226b4","b083c6303b87346ad06f99fad02eb7999975bad1f1751b882963175d6291bd9a","8118aa181755e29ec6da13bd827ddf8798567bf90835b691b4de32b82f70216d","9d0cc02ee58d6651d78caccf6ac9bae998838f2596fe00b60854fbe6f322d675","9341064d046bf2bfe45aec608dc6711aec7c7a50ec898eb2152be5b54b4b8dea","14a44365a39ef2e75aa65988534a99ae0853471bb478c8f8b51b3f1f8eb29de5","ec58942a3a3636a40d20f3c6d79b263fdaa05302695f77dfd2e938706913f46c","24a4274fcdbbe32ac9e112c82886b3167cd8cac504944b3bb74e2d7a55593047","df7281a02750a11124c2de5ec5b066bfc8d7104a3b3fc7663a0389cf1939f153","f77a3726e0580cc8b7109806b9cbdf7e477d80fbe5af1f742973740c231686cd","6a56b62937c923192cb6438261075372488c536d3f191fb786b308f8fbc7209f","49b61d34784da13fb443ac716458c59277ffeb8f51c404f3c560b0b41a757998","b0e96124091ee091232e54dc6654d05727e964f7f02068dc1f576d0ce0d68945","00fbdf5144d841ae46d99cd7abe8f5a0af2097de2cba704635706b09985ce12e","522a23356e6d56b8e41b9e8140cf928c0da9d328be3db76e4a64e26c467f405e","4f317d7396e59597a94638bbf47e5c464c7c0d35bcd7e50e7584b929b4de714c"],"parent_artifact_sha256":null,"schema_version":"artifact-manifest.v1","source_map_uri":"maps/7148cb69965b72f0ed85ff250d2057287f84ae091f1c9327c9c34d47aaa536b8.json","source_revision_id":"drive:fixture:synthetic-cellular-systems-field-guide:v1","source_sha256":"b8560cf15b8323d0758eff1829ec29dfec6512aa797531f07d0891d29aa89222","translation_profile_sha256":"7011f99e9351d9d70da9eddf89a2d38c3c88318e325cb4422ec98f492a9d2772"}
